### ISSUE TITLE
GoAccess SSH Tunnel Realtime Report stops at  275,000 Requests

### ISSUE THREAD

**Issue by gunit84** [allinurl/goaccess#837]
Hi there I am running go access via ssh tunnel using the realtime option:

nohup ssh  root@servername 'cat /var/log/httpd/access_log' | goaccess -r --log-format=COMBINED --real-time-html  -o /var/www/html/report_servername_webserver.html -g - &

When I run this it crashes at around 275,000 requests when I add the ssh -T option the same happens.

I am trying to figure out if goaccess has a limitation of requests with the realtime option or is this an issue with SSH and the amount of lines it can take from STDIN or a Kernel limitation, meaning I might have to adjust something?

Thanks for your help and great software.

**Comment by allinurl** [comment]
There's no limitation on how many requests can read, the limitation lies on your machine or server where it's being ran. 

When you say it crashes, do you get some sort of error message? Have you tried running it without `nohup` and without `&`.  Are you able to reproduce this when reading another access.log? Thanks

**Comment by gunit84** [comment]
Hi allinurl there is no error the command shell just exits. 

When the command run it holds the terminal and updates the report.

Yes it does look to be a process of the OS, because once the shell becomes available again,

If I run a top the same goacccess and pid are still running.

 There are no errors, nothing in the journalctl log either.

I am running RHEL 7.

Now I have to figure out whether it's kernel, bash or ssh limitation ... bit of a mystery....

**Comment by gunit84** [comment]
I tried the CLI Command Version:

ssh root@servername 'cat /var/log/httpd/access_log' | goaccess -a -

This ended up failing after around 25 minutes.

I thought it might be firewall related with SSH, so I caught a packet capture: 

* Please note these are obviously bogus  IP's:

16:24:39.743801 IP 1.1.1.1.38176 > 2.2.2.2.ssh: Flags [.], ack 84876734, win 2281, options [nop,nop,TS val 3320792 ecr 1114799868], length 0

16:25:17.444596 IP 1.1.1.1.38176 > 2.2.2.2.ssh: Flags [P.], seq 67855:67887, ack 84876734, win 2444, options [nop,nop,TS val 3358493 ecr 1114799868], length 32

16:25:17.444652 IP 1.1.1.1.38176 > 2.2.2.2.ssh: Flags [P.], seq 67887:67951, ack 84876734, win 2444, options [nop,nop,TS val 3358493 ecr 1114799868], length 64

16:25:17.445291 IP 1.1.1.1.38176 > 2.2.2.2.ssh: Flags [F.], seq 67951, ack 84876734, win 2444, options [nop,nop,TS val 3358493 ecr 1114799868], length 0

16:25:17.447806 IP 1.1.1.1.38176 > 2.2.2.2.ssh: Flags [.], ack 84876735, win 2444, options [nop,nop,TS val 3358496 ecr 1114837574], length 0

Looks to have the FIN Flag, that states the connection is closing properly.

So could be something in the bash shell, ssh environment variables or kernel parameters closing this...

If someone who has a constant SSH Connection running with --real-time reports could comment would be great.

Thanks again.

**Comment by gunit84** [comment]
I connected to the process using strace to see how it dies, I do not understand much about it but heres the output for when it dies;

read(5, "", 4096)                       = 0
mmap(NULL, 491520, PROT_READ|PROT_WRITE, MAP_PRIVATE|MAP_ANONYMOUS, -1, 0) = 0x7ff8629fb000
open("/proc/meminfo", O_RDONLY|O_CLOEXEC) = 14
fstat(14, {st_mode=S_IFREG|0444, st_size=0, ...}) = 0
mmap(NULL, 4096, PROT_READ|PROT_WRITE, MAP_PRIVATE|MAP_ANONYMOUS, -1, 0) = 0x7ff86e058000
read(14, "MemTotal:        3881416 kB\nMemF"..., 1024) = 1024
close(14)                               = 0
munmap(0x7ff86e058000, 4096)            = 0
mmap(NULL, 491520, PROT_READ|PROT_WRITE, MAP_PRIVATE|MAP_ANONYMOUS, -1, 0) = 0x7ff862983000
munmap(0x7ff862983000, 491520)          = 0
munmap(0x7ff8629fb000, 491520)          = 0
brk(0)                                  = 0x3c06000
brk(0x3c52000)                          = 0x3c52000
brk(0)                                  = 0x3c52000
brk(0x3c8e000)                          = 0x3c8e000
stat("/etc/localtime", {st_mode=S_IFREG|0644, st_size=2197, ...}) = 0
stat("/etc/localtime", {st_mode=S_IFREG|0644, st_size=2197, ...}) = 0
stat("/etc/localtime", {st_mode=S_IFREG|0644, st_size=2197, ...}) = 0
stat("/var/log/httpd/access_log", {st_mode=S_IFREG|0644, st_size=23981, ...}) = 0
write(6, "\0\0\0\0\0\0\0\1\0\1g\336", 12) = 12
write(6, "{\"general\": {\"start_date\": \"09/J"..., 92126) = 65536
write(6, "n\",\"items\": [{\"hits\": {\"count\": "..., 26590) = 26590
nanosleep({0, 200000000}, NULL)         = 0
nanosleep({0, 800000000}, NULL)         = 0
stat("/var/log/httpd/access_log", {st_mode=S_IFREG|0644, st_size=23981, ...}) = 0
read(5, "", 4096)                       = 0
brk(0)                                  = 0x3c8e000
brk(0x3d07000)                          = 0x3d07000
brk(0)                                  = 0x3d07000
brk(0)                                  = 0x3d07000
brk(0x3c18000)                          = 0x3c18000
brk(0)                                  = 0x3c18000
brk(0)                                  = 0x3c18000
brk(0x3c54000)                          = 0x3c54000
brk(0)                                  = 0x3c54000
brk(0x3c90000)                          = 0x3c90000
stat("/etc/localtime", {st_mode=S_IFREG|0644, st_size=2197, ...}) = 0
stat("/etc/localtime", {st_mode=S_IFREG|0644, st_size=2197, ...}) = 0
stat("/etc/localtime", {st_mode=S_IFREG|0644, st_size=2197, ...}) = 0
stat("/var/log/httpd/access_log", {st_mode=S_IFREG|0644, st_size=23981, ...}) = 0
write(6, "\0\0\0\0\0\0\0\1\0\1g\336", 12) = 12
write(6, "{\"general\": {\"start_date\": \"09/J"..., 92126) = 65536
write(6, "n\",\"items\": [{\"hits\": {\"count\": "..., 26590) = 26590
nanosleep({0, 200000000}, NULL)         = 0
nanosleep({0, 800000000}, ^CProcess 2860 detached

**Comment by gunit84** [comment]
**More Information:**


**# Config File:**

vim /usr/local/etc/goaccess.conf

time-format %H:%M:%S
date-format %d/%b/%Y

log-format %h %^[%d:%t %^] "%r" %s %b "%R" "%u"
log-file /var/log/httpd/access_log

daemonize true

addr 0.0.0.0
port 7890
real-time-html true

ws-url ws://servername

geoip-database /opt/Downloads/GeoIP.dat


**# Command:**

[root@fakeserver ~]# time ssh root@servername 'cat /var/log/httpd/access_log' | goaccess -r --log-format=COMBINED --real-time-html  -o /var/www/html/report_servername.html -g --html-report-title=servername_webserver_http_access_log -a - ; echo $?
Daemonized GoAccess: 2778

real    24m51.586s
user    0m0.353s
sys     0m0.409s
0

**Comment by gunit84** [comment]
Sorry for wasting your time wrong command I wanted a realtime log I should have been using 'tail' instead of cat for a once off report.

**Comment by allinurl** [comment]
You are right, tail should do it. Also, try adding this to your `/etc/ssh/ssh_config`, it should help too:

    ServerAliveInterval 60
    TCPKeepAlive yes
